{
  "format_version": "0.1.0-draft.1",
  "export_id": "exp_demo_0001",
  "exported_at": "2026-08-29T11:00:01Z",
  "project_id": "prj_demo_release",
  "records": [
    {
      "schema_version": "0.1.0-draft.1",
      "id": "ctx_demo_release_rule",
      "revision": 1,
      "project_id": "prj_demo_release",
      "kind": "Decision",
      "statement": "가상 릴리스 프로젝트에서는 배포 전에 회귀 테스트를 실행한다.",
      "subject": {
        "id": "ent_demo_release",
        "label": "가상 릴리스 절차"
      },
      "predicate": "requires",
      "object": {
        "type": "literal",
        "value": "배포 전 회귀 테스트"
      },
      "origin": "user_asserted",
      "extraction_method": "model_generated",
      "verification": "source_checked",
      "review": {
        "status": "user_approved",
        "approved_at": "2026-08-29T11:00:00Z",
        "approval_method": "authenticated_ui"
      },
      "sources": [
        {
          "source_id": "src_demo_excerpt_001",
          "kind": "user_excerpt",
          "availability": "available",
          "locator": "urn:synthetic:source:release-rule",
          "excerpt": "이 가상 프로젝트에서는 배포 전에 회귀 테스트를 실행하는 것으로 정하겠습니다."
        }
      ],
      "valid_from": "2026-08-29T11:00:00Z",
      "valid_until": null,
      "recorded_at": "2026-08-29T11:00:00Z",
      "status": "active",
      "supersedes": []
    }
  ],
  "relations": [],
  "next_cursor": null,
  "redaction_notes": []
}
